{
  "$schema": "https://json-schema.org/draft/2020-12/schema",
  "$id": "https://cejel.dev/schemas/llm/detector-freeze-v1.json",
  "title": "Cejel Free LLM detector freeze",
  "type": "object",
  "additionalProperties": false,
  "required": ["schema_version", "protocol_id", "status", "frozen_at", "detector", "execution", "rule_ids", "support_matrix", "release_thresholds", "golden_correction_ledger", "golden_execution_evidence", "untouched_results_seen_before_freeze", "record_sha256"],
  "properties": {
    "schema_version": {"const": "1.0.0"},
    "protocol_id": {"const": "cejel-llm-calibration-v1"},
    "status": {"const": "detector_frozen_before_untouched"},
    "frozen_at": {"type": "string", "format": "date-time"},
    "detector": {
      "type": "object",
      "additionalProperties": false,
      "required": ["git_commit", "source_tree_sha", "build_sha256", "artifact_name", "build", "runtime"],
      "properties": {
        "git_commit": {"type": "string", "pattern": "^[a-f0-9]{40}$"},
        "source_tree_sha": {"type": "string", "pattern": "^(?:[a-f0-9]{40}|[a-f0-9]{64})$"},
        "build_sha256": {"type": "string", "pattern": "^[a-f0-9]{64}$"},
        "artifact_name": {"type": "string", "minLength": 1},
        "build": {
          "type": "object",
          "additionalProperties": false,
          "required": ["command", "output_relative_path", "first_build_sha256", "second_build_sha256", "first_output_tree_sha256", "second_output_tree_sha256", "deterministic_rebuild_verified"],
          "properties": {
            "command": {"type": "array", "minItems": 1, "items": {"type": "string", "minLength": 1}},
            "output_relative_path": {"type": "string", "minLength": 1, "pattern": "^(?!/)(?!.*(?:^|/)\\.{1,2}(?:/|$)).+$"},
            "first_build_sha256": {"type": "string", "pattern": "^[a-f0-9]{64}$"},
            "second_build_sha256": {"type": "string", "pattern": "^[a-f0-9]{64}$"},
            "first_output_tree_sha256": {"type": "string", "pattern": "^[a-f0-9]{64}$"},
            "second_output_tree_sha256": {"type": "string", "pattern": "^[a-f0-9]{64}$"},
            "deterministic_rebuild_verified": {"const": true}
          }
        },
        "runtime": {
          "type": "object",
          "additionalProperties": false,
          "required": ["name", "version", "platform", "architecture"],
          "properties": {
            "name": {"type": "string", "minLength": 1},
            "version": {"type": "string", "minLength": 1},
            "platform": {"type": "string", "minLength": 1},
            "architecture": {"type": "string", "minLength": 1}
          }
        }
      }
    },
    "execution": {
      "type": "object",
      "additionalProperties": false,
      "required": ["workflow", "command_template", "network_isolation"],
      "properties": {
        "workflow": {
          "type": "object", "additionalProperties": false,
          "required": ["path", "sha256"],
          "properties": {
            "path": {"const": ".github/workflows/llm-calibration.yml"},
            "sha256": {"type": "string", "pattern": "^[a-f0-9]{64}$"}
          }
        },
        "command_template": {"type": "array", "minItems": 8, "items": {"type": "string"}},
        "network_isolation": {
          "type": "object",
          "additionalProperties": false,
          "required": ["mode", "argv_prefix", "evidence_reference", "wrapper_sha256", "hook_sha256", "probe_path", "probe_sha256", "probe_output_sha256", "probe_denied", "probe_attempted", "explicitly_confirmed"],
          "properties": {
            "mode": {"enum": ["node-runtime-deny-hook-v1", "node-runtime-deny-hook-v2"]},
            "argv_prefix": {"const": ["calibration/llm/scripts/no-egress-wrapper.sh"]},
            "evidence_reference": {"type": "string", "minLength": 8},
            "wrapper_sha256": {"type": "string", "pattern": "^[a-f0-9]{64}$"},
            "hook_sha256": {"type": "string", "pattern": "^[a-f0-9]{64}$"},
            "probe_path": {"const": "calibration/llm/scripts/no-egress-probe.mjs"},
            "probe_sha256": {"type": "string", "pattern": "^[a-f0-9]{64}$"},
            "probe_output_sha256": {"type": "string", "pattern": "^[a-f0-9]{64}$"},
            "probe_denied": {"type": "integer"},
            "probe_attempted": {"type": "integer"},
            "explicitly_confirmed": {"const": true}
          },
          "oneOf": [
            {
              "properties": {
                "mode": {"const": "node-runtime-deny-hook-v1"},
                "probe_denied": {"const": 5},
                "probe_attempted": {"const": 5}
              }
            },
            {
              "properties": {
                "mode": {"const": "node-runtime-deny-hook-v2"},
                "probe_denied": {"const": 12},
                "probe_attempted": {"const": 12}
              }
            }
          ]
        }
      }
    },
    "rule_ids": {
      "type": "array",
      "minItems": 8,
      "maxItems": 8,
      "uniqueItems": true,
      "items": {"pattern": "^LLM-[A-Z]{3}-[0-9]{3}$"}
    },
    "support_matrix": {"type": "object"},
    "release_thresholds": {
      "type": "object",
      "additionalProperties": false,
      "required": ["byte_sha256", "canonical_sha256"],
      "properties": {
        "byte_sha256": {"type": "string", "pattern": "^[a-f0-9]{64}$"},
        "canonical_sha256": {"type": "string", "pattern": "^[a-f0-9]{64}$"}
      }
    },
    "golden_correction_ledger": {
      "type": "object",
      "additionalProperties": false,
      "required": ["sha256", "golden_manifest_sha256", "golden_opportunity_manifest_sha256", "golden_label_evidence_sha256", "missed_defects", "status", "entries", "open_corrections", "frozen_at"],
      "properties": {
        "sha256": {"type": "string", "pattern": "^[a-f0-9]{64}$"},
        "golden_manifest_sha256": {"type": "string", "pattern": "^[a-f0-9]{64}$"},
        "golden_opportunity_manifest_sha256": {"type": "string", "pattern": "^[a-f0-9]{64}$"},
        "golden_label_evidence_sha256": {"type": "string", "pattern": "^[a-f0-9]{64}$"},
        "missed_defects": {"type": "integer", "minimum": 0},
        "status": {"const": "frozen"},
        "entries": {"type": "integer", "minimum": 0},
        "open_corrections": {"const": 0},
        "frozen_at": {"type": "string", "format": "date-time"}
      }
    },
    "golden_execution_evidence": {
      "type": "object",
      "additionalProperties": false,
      "required": ["sha256", "executions", "findings", "golden_manifest_sha256", "detector_build_sha256"],
      "properties": {
        "sha256": {"type": "string", "pattern": "^[a-f0-9]{64}$"},
        "executions": {"type": "integer", "minimum": 1},
        "findings": {"type": "integer", "minimum": 0},
        "golden_manifest_sha256": {"type": "string", "pattern": "^[a-f0-9]{64}$"},
        "detector_build_sha256": {"type": "string", "pattern": "^[a-f0-9]{64}$"}
      }
    },
    "untouched_results_seen_before_freeze": {"const": false},
    "record_sha256": {"type": "string", "pattern": "^[a-f0-9]{64}$"}
  }
}
